{
  "backend": {
    "commit": "65c795e87321e79b960ac8a7495a205de6a24ec0",
    "directory": "/tmp/vrp4-backend-65c795e",
    "runner": {
      "path": "/tmp/vrp4-backend-65c795e/target/release/picocalc-run",
      "sha256": "613aa318e546cea1b89934e2ee3091b640ca8cf4860abfefa7f668ec0395bf2c"
    }
  },
  "device": {
    "board": "picocalc",
    "keyboard": true,
    "lcd_variant": "pio-rgb565",
    "psram": true,
    "sd": {
      "attached": true,
      "format": "fat32"
    }
  },
  "firmware": {
    "path": "/tmp/vrp2-real/picotetris/build/PicoTetris.bin",
    "sha256": "0784d80d0d00c9bf86d06e903234bc022db5bda2ff193e17533c65b9c2546e62"
  },
  "launch": {
    "contract": {
      "argv": [
        "/tmp/vrp4-backend-65c795e/target/release/picocalc-run",
        "--bin",
        "/tmp/vrp2-real/picotetris/build/PicoTetris.bin",
        "--bootrom",
        "/tmp/vrp4-backend-65c795e/roms/rp2040/bootrom-rp2040-b2.bin",
        "--board",
        "picocalc",
        "--lcd-variant",
        "pio-rgb565",
        "--quantum",
        "1",
        "--backend-commit",
        "65c795e87321e79b960ac8a7495a205de6a24ec0",
        "--preview-api",
        "--psram",
        "--keyboard",
        "--sd",
        "--sd-format",
        "fat32"
      ],
      "bootrom": {
        "path": "/tmp/vrp4-backend-65c795e/roms/rp2040/bootrom-rp2040-b2.bin",
        "sha256": "9c19b46f068c21f90d200c514faad4a0d5cecfc978f155b8c9d25cb6bc2efd81"
      },
      "cwd": "/tmp/vrp4-backend-65c795e",
      "mode": "preview-api",
      "schema_version": 1
    },
    "contract_sha256": "2309fa6eada4b85d141a7476e396794a0091c99781566ddaee35b3b01564e857",
    "gui_started": false,
    "preview_ipc_schema": 1
  },
  "receipt_id": "picotetris-opt1b-vrp4-rev9-0784d80d0d00",
  "report": {
    "path": "/home/fuyuki/pico_dvl/codex/picocalc_emu/firmware-validation/records/vrp4-picotetris-20260829-01/run-report.json",
    "schema_version": 8,
    "sha256": "daad3495e63edc8aec1d0b72934f62a455593489c89ada59be685a1084623534"
  },
  "schema_version": 1,
  "status": "admitted",
  "target": {
    "contract_sha256": "ec6cdb8f8eafc86bc64da3699403c57095c9ea20af1adb93fe2ebfb26b78bb92",
    "id": "picotetris-opt1b-vrp4",
    "revision": 9
  }
}
